{
  "schema_version": "orchestra.compliance-registry.r7-surface.v1",
  "canonical_repository": "Baelfyre/Orchestra-Compliance-Registry",
  "authority": "DESCRIPTIVE_NON_AUTHORIZING",
  "architecture_anchor": {
    "commit": "c1910806ed3ea9147af96b1c49a9f72aef75e0f6",
    "tree": "0c37d7bf47fc20b49b26fea156c8e180db57b4a3",
    "document": "docs/TOKEN_EFFICIENT_QUERY_ARCHITECTURE_R7.md",
    "document_blob": "9f24a10f455a77509ec5246e6981ca2672624ca1"
  },
  "implementation": {
    "status": "IMPLEMENTED_R7_1_R7_9_TRUSTED_V0_4_0_PUBLISHED_O7_7_CONFORMANCE_COMPLETE",
    "contract_version": "1.0.0",
    "phases": {
      "R7.1": "IMPLEMENTED_STABLE",
      "R7.2": "IMPLEMENTED_STABLE",
      "R7.3": "IMPLEMENTED_STABLE",
      "R7.4": "IMPLEMENTED_STABLE",
      "R7.5": "IMPLEMENTED_STABLE",
      "R7.6": "IMPLEMENTED_STABLE",
      "R7.7": "IMPLEMENTED_VALIDATED",
      "R7.8": "IMPLEMENTED_VALIDATED",
      "R7.9": "IMPLEMENTED_VALIDATED"
    }
  },
  "gateway": {
    "path": "scripts/r7_query_gateway.py",
    "query_receipt_schema": "schema/r7-query-receipt.schema.json",
    "read_only": true,
    "shared_selection_semantics": true,
    "mcp_adapter": "scripts/r7_mcp_server.py"
  },
  "index": {
    "schema_version": "orchestra.compliance-registry.r7-index.v1",
    "authority": "DERIVED_DISPOSABLE_READ_CACHE",
    "requires_trusted_release_identity": true,
    "digest_mismatch_disposition": "REJECT_INDEX_REBUILD_OR_FALLBACK",
    "trusted_release_installer": "scripts/r7_trusted_release.py"
  },
  "projections": ["MINIMAL", "SUMMARY", "EVIDENCE", "FULL"],
  "transport": {
    "precedence": ["DIRECT_LOCAL_INDEXED_GATEWAY", "DIRECT_LOCAL_JSON_QUERY", "OPTIONAL_MCP_TRANSPORT"],
    "mcp_available": true,
    "mcp_disposition": "IMPLEMENTED_READ_ONLY_TRANSPORT",
    "mcp_tools": ["registry_status", "registry_query", "registry_get", "registry_relations", "registry_freshness", "registry_delta"]
  },
  "capabilities": {
    "supported": ["cap.query.projection.v1", "cap.query.relationships.v1", "cap.query.indexed-read.v1", "cap.query.budget.v1", "cap.transport.mcp.v1"],
    "not_yet_supported": []
  },
  "trusted_release_integration": {
    "path": "scripts/r7_trusted_release.py",
    "verify_before_install": true,
    "verify_member_digests": true,
    "canonical_json_remains_authority": true,
    "index_rebuildable": true,
    "replacement_requires_explicit_flag": true
  },
  "benchmark": {
    "path": "scripts/r7_benchmark.py",
    "test": "tests/test_r7_benchmark.py",
    "evidence_artifact": "r7-efficiency-benchmark-${GITHUB_SHA}",
    "host_tokens_fabricated_when_unavailable": false,
    "benefit_claim_requires_measured_evidence": true
  },
  "orchestra_entry_gate": {
    "token": "IMPLEMENTED_STABLE_REGISTRY_R7_SURFACE_REQUIRED",
    "satisfied": true,
    "scope": "O7.1_THROUGH_O7.6_RUNTIME_IMPLEMENTATION"
  },
  "authority_boundaries": {
    "legal_interpretation": false,
    "project_applicability": false,
    "registry_mutation": false,
    "orchestra_execution": false,
    "automatic_merge": false,
    "trusted_release_publication": false
  },
  "release_boundary": {
    "planned_tag": "registry-v0.4.0",
    "published": true,
    "trusted_publication_separate": true,
    "publication_state": "PUBLISHED_IMMUTABLE_VERIFIED_AND_O7_7_CONFORMANCE_COMPLETE"
  }
}
